{"grao":"1 linha por período × região × grupo de cliente","dimensoes":{"periodo":["4s","13s","26s","base"],"regiao":["Região A","Região B","Região C","Região D","Região E","Região F","Lojas pequenas"],"grupo":["Fiéis","Regulares","Esporádicos","Em pausa","Sem segmento"]},"colunas":["periodo","regiao","grupo","faturamento"],"linhas":[[0,0,0,67055.03],[0,0,1,25199.48],[0,0,2,1756.11],[0,1,0,44418.51],[0,1,1,23237.32],[0,1,2,2362.65],[0,2,0,50169.73],[0,2,1,10177.93],[0,2,2,1148.79],[0,3,0,42856.37],[0,3,1,17764.64],[0,3,2,967.5],[0,4,0,32631.78],[0,4,1,14180.57],[0,4,2,854.5],[0,5,0,7497.04],[0,5,1,2158.46],[0,5,2,235.42],[0,6,0,2745.1],[0,6,1,1454.54],[0,6,2,241.77],[1,0,0,215044.26],[1,0,1,76112.36],[1,0,2,6783.77],[1,0,3,607.47],[1,1,0,138304.0],[1,1,1,69336.09],[1,1,2,8851.47],[1,1,3,353.64],[1,2,0,160922.58],[1,2,1,36327.64],[1,2,2,4326.17],[1,2,3,336.52],[1,3,0,139641.54],[1,3,1,52083.78],[1,3,2,5143.0],[1,3,3,173.04],[1,4,0,102371.1],[1,4,1,41628.6],[1,4,2,3293.77],[1,4,3,293.92],[1,5,0,26003.35],[1,5,1,8372.14],[1,5,2,1306.14],[1,5,3,35.14],[1,6,0,5602.5],[1,6,1,4155.46],[1,6,2,769.85],[1,6,3,38.76],[2,0,0,414164.79],[2,0,1,140625.78],[2,0,2,11988.53],[2,0,3,4229.45],[2,1,0,271092.79],[2,1,1,133578.15],[2,1,2,16393.61],[2,1,3,3049.96],[2,2,0,311672.6],[2,2,1,71683.76],[2,2,2,7036.9],[2,2,3,2746.38],[2,3,0,261520.2],[2,3,1,103236.0],[2,3,2,8985.05],[2,3,3,3509.9],[2,4,0,203736.99],[2,4,1,80960.94],[2,4,2,6583.04],[2,4,3,1672.76],[2,5,0,52584.91],[2,5,1,16011.32],[2,5,2,2322.17],[2,5,3,243.56],[2,6,0,10438.9],[2,6,1,10157.82],[2,6,2,1445.43],[2,6,3,140.31],[3,0,0,1293275.54],[3,0,1,521258.92],[3,0,2,63110.23],[3,0,3,49245.49],[3,0,4,9285.71],[3,1,0,843569.65],[3,1,1,465564.8],[3,1,2,91194.13],[3,1,3,24860.17],[3,1,4,4427.84],[3,2,0,977248.01],[3,2,1,261245.2],[3,2,2,45431.07],[3,2,3,24836.45],[3,2,4,14377.63],[3,3,0,777878.83],[3,3,1,367468.87],[3,3,2,47352.85],[3,3,3,28779.35],[3,3,4,5632.41],[3,4,0,663683.0],[3,4,1,303300.16],[3,4,2,46207.46],[3,4,3,21066.7],[3,4,4,2265.11],[3,5,0,160535.84],[3,5,1,72336.75],[3,5,2,15233.28],[3,5,3,6511.37],[3,5,4,393.98],[3,6,0,39313.94],[3,6,1,46394.42],[3,6,2,12773.78],[3,6,3,1478.72],[3,6,4,3312.16]]}